{
  "weapon_categories": [
    "W01",
    "W02",
    "W03"
  ],
  "targets": [
    "G01",
    "G02",
    "G03",
    "G04"
  ],
  "stages": [
    "K01",
    "K02",
    "K03"
  ],
  "weapon_unit_cost": {
    "W01": 5,
    "W02": 7,
    "W03": 9
  },
  "weapon_target_destroy_probability": {
    "W01": {
      "G01": 0.46,
      "G02": 0.495,
      "G03": 0.53,
      "G04": 0.565
    },
    "W02": {
      "G01": 0.565,
      "G02": 0.6,
      "G03": 0.32,
      "G04": 0.355
    },
    "W03": {
      "G01": 0.355,
      "G02": 0.39,
      "G03": 0.425,
      "G04": 0.46
    }
  },
  "stage_weapon_inventory": {
    "K01": {
      "W01": 8,
      "W02": 8,
      "W03": 6
    },
    "K02": {
      "W01": 8,
      "W02": 8,
      "W03": 7
    },
    "K03": {
      "W01": 8,
      "W02": 8,
      "W03": 5
    }
  },
  "target_stage_availability": {
    "G01": {
      "K01": 1,
      "K02": 1,
      "K03": 1
    },
    "G02": {
      "K01": 1,
      "K02": 1,
      "K03": 1
    },
    "G03": {
      "K01": 1,
      "K02": 1,
      "K03": 1
    },
    "G04": {
      "K01": 1,
      "K02": 1,
      "K03": 1
    }
  },
  "target_damage_threshold": {
    "G01": 0.5,
    "G02": 0.515,
    "G03": 0.53,
    "G04": 0.545
  }
}
